{
  "$schema": "ldfreq-resource-inventory.schema.json",
  "schema_version": "0.1.0",
  "reviewed_on": "2026-08-06",
  "package_scope": "public-api-resource-release-candidate",
  "policy": {
    "release_requires_independent_approval": false,
    "release_requires_maintainer_license_decision": true,
    "uncertainty_default": "exclude",
    "runtime_network_access": false,
    "implicit_download_or_fallback": false
  },
  "release_approved_resource_count": 1,
  "included_resources": [
    {
      "resource_id": "tubelex-en-treebank-slim",
      "resource_version": "7cb5fb36-slim-v1",
      "distribution_state": "release-candidate",
      "runtime_state": "public",
      "release_approved": true,
      "public_api": true,
      "license_spdx": "BSD-3-Clause",
      "source_commit": "7cb5fb36add76b83a266d1967536e1a1d3faa513",
      "source_sha256": "4096022259d5eaa7261c3bf22c3b0af9fd58ae8eebe17894c0b34a163954f936",
      "raw_source_bundled": false,
      "raw_subtitles_or_identifiers_included": false,
      "manifest_sha256": "a0936c52cbeeccd807161e7236c8d01303819a968ee3be4d84e002966574bb1d",
      "artifact_sha256": "ded083e5b9f59ddfb719ebd88063778500cb347e1eab0f2d79ff55085d92fb4d",
      "content_sha256": "423dd4631c9da2f7442705d2930126da4cba980e46b6a5c0dda98336dce74916",
      "package_members": [
        {
          "path": "extdata/tubelex/7cb5fb36/resource.manifest.dcf",
          "bytes": 964,
          "sha256": "a0936c52cbeeccd807161e7236c8d01303819a968ee3be4d84e002966574bb1d"
        },
        {
          "path": "extdata/tubelex/7cb5fb36/tubelex_en_treebank_7cb5fb36_slim.csv.gz",
          "bytes": 2549714,
          "sha256": "ded083e5b9f59ddfb719ebd88063778500cb347e1eab0f2d79ff55085d92fb4d"
        },
        {
          "path": "extdata/tubelex/7cb5fb36/build-provenance.json",
          "bytes": 6261,
          "sha256": "d728e89cd14b4b3bc2df2ce1b99e26a6136b61e081319dc2be191695f3f6d04d"
        },
        {
          "path": "licenses/tubelex/NOTICE.md",
          "bytes": 4175,
          "sha256": "a3ea8312a5bbf8e7178155259460f089d0377a8c99094f70875910c428cb4cb5"
        },
        {
          "path": "COPYRIGHTS",
          "bytes": 658,
          "sha256": "08ca83f34d2cec91bbdf84f40f9737de57e9e2f6e3fe641443a5ed8b501429c1"
        }
      ],
      "open_gates": [
        "final release-candidate source, installed, and binary inventory audit"
      ]
    }
  ],
  "not_included": [
    {
      "resource_id": "ngsl-1.2",
      "decision": "defer",
      "reason": "Exact ranked, research-form, and supplementary source bytes plus the CC-BY-SA notice unit are not yet co-promoted."
    },
    {
      "resource_id": "oewn-2025",
      "decision": "defer",
      "reason": "The OEWN and Princeton WordNet cumulative notice and artifact unit is not yet co-promoted."
    },
    {
      "resource_id": "nj8",
      "decision": "exclude",
      "reason": "The official workbook is publicly downloadable and permits personal research use with citation, while directing commercial users to consult JACET in advance. It does not grant an explicit downstream package-redistribution license. The list is therefore not bundled or downloaded; the public level-profile adapter accepts only a caller-supplied copy."
    },
    {
      "resource_id": "antbnc-lemma-list",
      "decision": "exclude",
      "reason": "The AntBNC lemma list is publicly downloadable, but an explicit standalone downstream package-redistribution grant was not identified. The list is not bundled or downloaded; lexdiv_flemmatize() accepts a caller-supplied local copy and records only path-private identity and coverage."
    },
    {
      "resource_id": "ngsl-31k-workbook",
      "decision": "exclude",
      "reason": "Schema, rank, corpus-version, and unlabelled-tail rights scope remain unresolved."
    },
    {
      "resource_id": "coca",
      "decision": "exclude",
      "reason": "No distributable corpus or derived runtime payload is approved for this package."
    },
    {
      "resource_id": "ellipse-corpus",
      "decision": "research-only",
      "reason": "The non-commercial corpus is excluded from package runtime, examples, tests, and downloads."
    },
    {
      "resource_id": "python-resource-derived-golden-outputs",
      "decision": "exclude",
      "reason": "Generated-output and component-license scope is not established for the R package."
    }
  ]
}
